Page Type,Path,Title,Description
Key Page,/,Kitchen Tools That Actually Work | 24 Years Restaurant Tested,"Real equipment reviews from a chef who's used everything—from Purple Café line cook to Mellow Mushroom Kitchen Manager. No BS, just tools that work."
Key Page,/about,Why A Restaurant Chef Reviews Kitchen Tools,"24 years in professional kitchens—Purple Café, Mellow Mushroom, Il Pizzaiolo. I test equipment in real conditions, not lab settings."
Key Page,/contact,Contact Chef Approved Tools | Questions & Feedback,Have a question about kitchen equipment? Want to suggest a review? I read every message and respond personally.
Key Page,/chef-approved,Chef Approved: What It Means | Pro Kitchen Reviews,"Learn what ""Chef Approved"" means at ChefApprovedTools.com. Scott Bradley reviews kitchen equipment based on 24 years of professional restaurant experience using a transparent three-tier system."
Key Page,/kitchen-bundle,Essential Kitchen Starter: 10 Year Pro-Tested,Professional kitchen starter kit: 10 essential tools tested 24 years. From knives to cookware. Restaurant veteran-approved. Build your pro kitchen.
Key Page,/the-tools-that-started-it-all,Tools That Started It All: My Culinary School Essentials,The 11 essential kitchen tools I packed for culinary school in 2005 that I still use 20 years later. Professional-grade equipment that survived decades of restaurant abuse.
Key Page,/glossary,Kitchen Terms Glossary: Pro Cuts & Tools,"Kitchen terms defined: Equipment specs, knife cuts, baking conversions. Julienne, brunoise, NSF certification explained. Professional techniques guide."
Key Page,/review-tiers,Three-Tier Testing: Review Methodology,"Understand how we test and review kitchen equipment. Three tiers of transparency: Restaurant-tested, actively testing, and experience-based recommendations."
Key Page,/newsletter,Equipment Newsletter: Pro Tips & Insights,Get equipment insights and honest product recommendations from 24 years of restaurant experience. Join fellow home chefs getting expert insights.
Legal Page,/privacy-policy,Privacy Policy | Chef Approved Tools Legal,"Privacy policy for Chef Approved Tools - How we collect, use, and protect your personal information in compliance with GDPR and CCPA."
Legal Page,/terms,Terms of Service | Chef Approved Tools Info,Terms of Service for Chef Approved Tools - Legal terms and conditions for using our website and services.
Legal Page,/cookie-policy,Cookie Policy | Chef Approved Tools Notice,Cookie Policy for Chef Approved Tools - How we use cookies and similar technologies on our website.
Legal Page,/disclosure,Affiliate Disclosure | Chef Approved Tools,Full disclosure of our affiliate relationships and how we earn commissions from product reviews and recommendations.
Hub Page,/blog,Restaurant Techniques That Actually Work at Home,24 years of professional cooking methods translated for home kitchens. Learn what actually matters vs. what's just chef theater.
Hub Page,/reviews,All Reviews: Chef-Tested Kitchen Equipment,Complete collection of professional kitchen equipment reviews tested in real restaurant environments and home kitchens.
Hub Page,/guides,Kitchen Equipment Guides | Chef's Picks,Expert guidance from a culinary professional to help you make informed equipment decisions.
Hub Page,/knives,"Chef Knives Hub: All Reviews, Guides, Tips","Professional chef reviews of kitchen knives tested over years in restaurant kitchens. Chef knives, paring knives, bread knives, and specialty blades."
Hub Page,/cookware,Best Cookware 2025 | Chef Pots & Pans Guide,"Professional cookware reviews: Pans, pots, Dutch ovens tested in restaurant kitchens or in my apartment . What works, what lasts. Chef-approved."
Hub Page,/appliances,Kitchen Appliances 2025 | Pro Chef Reviews,"Professional chef reviews of blenders, mixers, food processors, and essential kitchen appliances tested in commercial restaurant settings."
Guide,/guides/best-chef-knives,Best Chef Knives 2025: Expert Buying Guide,Best chef knives 2025: Professional chef reviews from 24 years experience. German workhorses to Japanese precision. Real restaurant kitchen testing.
Guide,/guides/best-cookware,Restaurant-Grade Cookware: Pro Comparison,Professional cookware recommendations from 24 years of restaurant experience. Find pans that survive commercial use.
Guide,/guides/cookware-materials,Cookware Materials: Chef's Metal Comparison,"Complete guide to cookware materials from 24 years of restaurant experience. Stainless steel, cast iron, carbon steel, and more."
Guide,/guides/kitchen-appliances,Commercial Kitchen Appliances 2025: Guide,"Professional kitchen appliance reviews. Blenders, mixers, food processors tested in restaurants or in my apartment kitchen. Commercial-grade performance."
Guide,/guides/knife-care,Knife Care: Sharpening & Storage Techniques,"Professional knife care guide: Sharpening, storage, maintenance from restaurant kitchen manager. Keep your knives performing for decades."
Guide,/guides/affordable-kitchen-appliances,Budget Kitchen Appliances 2025: What Works,"Affordable kitchen appliances that work: Budget-friendly blenders, mixers tested by a professional chef. Restaurant quality without premium price."
SEO Landing,/best-budget-chef-knife,"Best Budget Chef Knife 2025: Victorinox 8""","Victorinox Fibrox 8"" tested 20 years: Best budget chef knife under $50. NSF certified, dishwasher safe, outperforms $200+ knives. Professional pick."
SEO Landing,/best-knife-for-cutting-meat,Best Meat Cutting Knife 2025: Boning Guide,"Victorinox 6"" boning knife: Best for trimming, deboning meat. Firm blade, Granton edge, NSF certified. Professional butcher's choice."
Blog Post,/blog/bacon-but-not-in-this-dish,7 Dishes Where Bacon Ruins Everything,Bacon doesn't belong everywhere. A chef with 24 years experience reveals when bacon overpowers instead of enhances.
Blog Post,/blog/benefits-cooking-with-garlic,Why Restaurants Use 10x More Garlic Than You Do,Professional kitchens go through cases of garlic weekly. Here's why garlic matters more than you think—and how to use it right.
Blog Post,/blog/best-scrambled-eggs,The Scrambled Egg Method That Changed Everything,"No bowl. No whisk. No milk. Just perfect, creamy eggs every time. The technique I've used for 45 years in professional kitchens."
Blog Post,/blog/blanching-vegetables-why-restaurants-do-it,Why Your Vegetables Look Sad (And Restaurant's Don't),Blanching is the secret. It's why restaurant vegetables are vibrant and yours aren't. Here's the professional technique.
Blog Post,/blog/braising-101-tough-cuts-made-tender,How to Turn Cheap Meat Into Restaurant-Quality Tender,Braising transforms $8/lb tough cuts into fall-apart tenderness. The low-and-slow technique every professional chef masters.
Blog Post,/blog/bread-science-gluten-development,Why Your Bread Is Dense (Gluten Science Explained),The chemistry behind fluffy bread vs. dense bricks. Kneading techniques and troubleshooting from 24 years of professional baking.
Blog Post,/blog/caramelization-science,Why Restaurant Caramel Tastes Better Than Yours,"Temperature and technique matter more than ingredients. Here's the chemistry behind deep, complex caramelization."
Blog Post,/blog/caramelizing-onions-why-it-takes-45-minutes,"Why ""10-Minute Caramelized Onions"" Is A Lie",Real caramelization takes 45 minutes. Here's why rushing it fails—and why the chemistry requires patience and proper heat.
Blog Post,/blog/carbon-footprint-kitchen-equipment-buy-once-cry-once,Why Cheap Kitchen Tools Are Worse for the Environment,"Durability is sustainability. Quality equipment lasts decades vs. cheap tools in landfills every 2 years. Buy once, cry once."
Blog Post,/blog/cast-iron-seasoning-care,How to Make Cast Iron Non-Stick (And Keep It That Way),The chemistry of cast iron seasoning explained by a chef who's maintained dozens over 24 years. Proper care and restoration.
Blog Post,/blog/cheese-sauce-mac-and-cheese,Why Your Cheese Sauce Breaks (And How to Fix It),"The béchamel technique that creates silky, smooth cheese sauce every time. No graininess, no breaking. Restaurant-quality results."
Blog Post,/blog/complete-guide-to-salts,Why Professional Chefs Only Keep 2 Types of Salt,"After 24 years in kitchens, I only use kosher and finishing salt. Here's why—and when you actually need each one."
Blog Post,/blog/cooking-with-tomatoes-fresh-vs-canned,When Canned Tomatoes Are Better Than Fresh,Controversial take: canned tomatoes often beat fresh. Here's when to use each—from 24 years in professional kitchens.
Blog Post,/blog/cookware-materials-explained,What Cookware Do Restaurant Chefs Actually Use?,"Stainless, cast iron, nonstick, carbon steel—which actually matter? A chef's honest take after 24 years of restaurant cooking."
Blog Post,/blog/cutting-board-materials-guide,Wood vs Plastic Cutting Boards: What Restaurants Use,"After cutting on everything for 24 years, here's what actually matters for your knives and food safety—wood, plastic, bamboo."
Blog Post,/blog/cutting-storing-fresh-herbs,Why Your Fresh Herbs Die in 2 Days (And Mine Don't),Professional cutting and storage techniques that keep herbs fresh for a week. The methods restaurants use for prep efficiency.
Blog Post,/blog/deglazing-pan-sauces,How to Turn Pan Drippings Into Restaurant Sauce,"Deglazing is the secret to professional pan sauces. Master fond, technique, and create restaurant-quality results in minutes."
Blog Post,/blog/dutch-oven-size-guide-which-quart-size,What Size Dutch Oven? 5.5-Qt vs 7-Qt Explained,Most home cooks need 5.5 or 7 quarts. Here's how to choose based on family size and what you actually cook—from 24 years of experience.
Blog Post,/blog/essential-knife-cuts-every-cook-should-master,5 Knife Cuts That Make You Look Like a Pro Chef,"Dice, julienne, chiffonade, mince, bias—these cuts separate amateurs from cooks who know what they're doing. Technique from 24 years."
Blog Post,/blog/fat-is-flavor,Why Restaurants Use More Fat Than You Think,"Fat carries flavor. Here's why professional kitchens use butter, oil, and animal fats to create deeply flavorful dishes."
Blog Post,/blog/food-processor-vs-blender,Food Processor vs Blender: Which One Do You Need?,Most home cooks only need one. Here's which tool matters for what you actually cook—from 24 years in professional kitchens.
Blog Post,/blog/guide-cooking-oils-smoke-points,Which Cooking Oil When? Smoke Points Explained,"Searing, sautéing, frying, finishing—which oil matters for each. Professional guide to smoke points and actual uses from 24 years."
Blog Post,/blog/hotel-pan-system-restaurant-organization-home,Why I Ditched Tupperware for Restaurant Hotel Pans,20 years of hotel pans at home. This restaurant storage system eliminates Tupperware chaos forever. Here's why every kitchen needs it.
Blog Post,/blog/how-to-choose-first-chef-knife,How to Choose Your First Chef Knife (Avoid These Mistakes),"Balance, steel type, blade length—what actually matters for your first knife. Why comfort beats price from 24 years of professional experience."
Blog Post,/blog/how-to-clean-burnt-stainless-steel-pans,How to Clean Burnt Stainless Steel Pans (Without Scrubbing),"Safe, effective methods from 24 years in professional kitchens. Restore burnt stainless steel cookware without damage or harsh scrubbing."
Blog Post,/blog/how-to-cook-perfect-pasta,Why Your Pasta Never Tastes Like Restaurant Pasta,"Water ratios, salt levels, timing—the professional technique that creates restaurant-quality pasta. 24 years of restaurant experience."
Blog Post,/blog/how-to-make-perfect-french-press-coffee,French Press Coffee: The Ratio Everyone Gets Wrong,"After 18 years of daily French press: the perfect ratio, technique, and mistakes to avoid. Cafe-quality coffee at home."
Blog Post,/blog/how-to-make-perfect-risotto,How Restaurants Make Risotto Creamy (Without Cream),"The technique, timing, and science behind perfectly creamy risotto. Professional method from 24 years in restaurant kitchens."
Blog Post,/blog/how-to-make-roux,"How to Make Roux: White, Blonde, Dark (Don't Burn It)","The foundation technique for bechamel, gumbo, and gravy. How to make each type of roux without burning from 24 years experience."
Blog Post,/blog/how-to-preheat-a-pan,Why Your Food Sticks (You're Not Preheating Right),The science of preheating stainless steel and cast iron pans. How to prevent sticking and achieve perfect sear from 24 years experience.
Blog Post,/blog/how-to-sear-steaks-like-restaurant-chef,How Restaurants Get That Perfect Steak Crust,The searing techniques that create perfect crust and temperature control. Restaurant methods from 24 years in professional kitchens.
Blog Post,/blog/how-to-sharpen-with-tri-stone,How to Sharpen Knives with Tri-Stone (Restaurant Method),"Step-by-step tri-stone technique perfected over 6 years in restaurants. Angles, pressure, progression for professional results at home."
Blog Post,/blog/how-to-steel-a-knife,How to Steel a Knife (Most People Do It Wrong),"Professional honing technique: angle, pressure, and why it's not sharpening. Chef guide to proper knife maintenance from 24 years."
Blog Post,/blog/hydration-health-water-intake,How Restaurant Chefs Stay Hydrated During 12-Hour Shifts,Hydration strategies from 24 years in professional kitchens. Why water intake matters for performance and how chefs handle long shifts.
Blog Post,/blog/kitchen-gloves-guide,Kitchen Gloves: When to Use (And When Not To),"Single-use, cut-resistant, and proper layering from 24 years in professional kitchens. When gloves protect and when they're dangerous."
Blog Post,/blog/kitchen-starter-kit-first-5-tools,The Only 5 Kitchen Tools You Actually Need,Most starter kits are garbage. A chef with 24 years experience reveals the only 5 tools worth buying first.
Blog Post,/blog/kitchen-thermometers-guide,Why Guessing Temperature Ruins Good Meat,Thermometers are the difference between perfect and overcooked. 24 years of restaurant cooking reveals the truth.
Blog Post,/blog/kitchen-tools-wasting-money,10 Kitchen Tools That Are Complete Garbage,Stop wasting money. A chef with 24 years experience reveals which popular tools are useless—and what to buy instead.
Blog Post,/blog/knife-safety-rules-professional-kitchens,How Not to Cut Yourself (10 Professional Rules),"24 years in restaurant kitchens, zero serious cuts. Here are the safety rules that actually prevent knife injuries."
Blog Post,/blog/knife-skills-how-to-hold-chef-knife,You're Holding Your Knife Wrong (Here's Why),The pinch grip changed everything. 24 years of professional knife work reveals the grip that actually gives control.
Blog Post,/blog/knife-storage-protecting-blades-for-decades,Why Drawer Storage Destroys Your Knives,Most knife storage ruins blades. 24 years of professional kitchen experience reveals the storage methods that keep knives sharp.
Blog Post,/blog/maillard-reaction-browning-flavor,The Chemistry That Makes Food Taste Amazing,Browning isn't just color—it's hundreds of new flavor compounds. 24 years of searing reveals why the Maillard reaction matters.
Blog Post,/blog/making-stock-professional-chef-method,Why Restaurant Stock Tastes 20x Better,Stock isn't soup base—it's liquid flavor. 24 years of professional kitchens reveals the technique that builds real depth.
Blog Post,/blog/meal-prep-station-setup-restaurant-efficiency,Why Restaurant Cooks Are 3x Faster Than You,It's the prep station. 24 years of professional cooking reveals the setup that eliminates kitchen chaos and wasted time.
Blog Post,/blog/meat-cooking-temperatures-thermometers,The Temperature Chart Every Cook Needs,Perfect doneness isn't guesswork. 24 years of professional cooking reveals the exact temps that ensure safety and quality.
Blog Post,/blog/mis-en-place-professional-cooking,Why Chefs Prep Everything Before Cooking,Mise en place changed everything. 24 years of professional cooking reveals the prep system that eliminates kitchen stress.
Blog Post,/blog/onions-cooking-guide,Why Most People Get Onions Wrong,"Yellow, white, red—they're not interchangeable. 24 years of professional cooking reveals which onion to use when."
Blog Post,/blog/oxidization-effect-on-food,Why Apples Turn Brown (And How to Stop It),Oxidation ruins color and flavor. 24 years of professional kitchen work reveals the chemistry behind browning—and how to prevent it.
Blog Post,/blog/potatoes-cooking-guide,Why Your Mashed Potatoes Are Gluey,"Wrong potato, wrong technique. 24 years of professional cooking reveals which potato to use for mashing, roasting, and frying."
Blog Post,/blog/reducing-sauces-restaurant-technique,How Restaurants Make Sauce Taste 10x Better,Reduction concentrates flavor. 24 years of professional cooking reveals the technique that turns thin liquid into restaurant sauce.
Blog Post,/blog/sheet-pan-cooking-restaurant-techniques,5 Sheet Pan Tricks From Restaurant Kitchens,High heat changes everything. 24 years of professional cooking reveals the sheet pan techniques restaurants use daily.
Blog Post,/blog/stainless-steel-why-food-sticks,Why Food Sticks to Stainless Steel Pans,It's not the pan—it's the heat. 24 years of professional cooking reveals the temperature trick that stops sticking.
Blog Post,/blog/stand-mixer-buying-guide,Is KitchenAid Worth $400? (Honest Answer),24 years of professional baking reveals what actually matters in stand mixers—and whether KitchenAid is worth the price.
Blog Post,/blog/stock-vs-broth-vs-bouillon,Stock vs Broth: They're Not the Same Thing,Gelatin changes everything. 24 years of professional cooking reveals why stock and broth aren't interchangeable.
Blog Post,/blog/understanding-acids-cooking,Why Your Food Tastes Flat (It Needs Acid),Acid is the missing ingredient. 24 years of professional cooking reveals how lemon and vinegar transform bland into balanced.
Blog Post,/blog/understanding-cooking-fats,When to Use Butter vs Oil (It Matters),Choosing the wrong fat ruins dishes. 24 years of professional cooking reveals which fat to use when—and why it matters.
Blog Post,/blog/understanding-umami-fifth-taste,The Secret Ingredient That Makes Food Addictive,It's umami—the fifth taste. 24 years of professional cooking reveals the glutamate science behind delicious food.
Blog Post,/blog/vegetable-roasting-guide,Why Restaurant Vegetables Taste Better Roasted,High heat creates caramelization. 24 years of professional cooking reveals the temperature and timing for perfect roasted vegetables.
Blog Post,/blog/what-is-braising,What Is Braising? (And Why It Makes Cheap Meat Tender),Low-and-slow cooking that transforms tough cuts into fall-apart tenderness. The braising technique from 24 years in kitchens.
Blog Post,/blog/what-is-emulsification,How Restaurants Make Oil and Water Mix (Emulsification),"The science behind mayonnaise, hollandaise, and vinaigrettes. Emulsification technique from 24 years in professional kitchens."
Blog Post,/blog/why-children-hate-broccoli,Why Kids Hate Broccoli (It's Genetic),Bitter taste receptors change with age. 24 years of professional cooking reveals the techniques that make vegetables kid-friendly.
Blog Post,/blog/why-cooking-science-matters,Stop Following Recipes. Learn the Science Instead.,Understanding chemistry transforms cooking. 24 years of professional experience reveals why knowing the science matters more than recipes.
Blog Post,/blog/why-professional-chefs-use-kosher-salt,Why Chefs Never Use Table Salt,Kosher salt's texture changes everything. 24 years of professional cooking reveals why the pinchable flakes give better control.
Blog Post,/blog/why-resting-meat-key-cooking,Why Cutting Meat Immediately Ruins It,Resting redistributes juices. 24 years of professional cooking reveals the science of carryover cooking and why patience matters.
Review,/reviews/benriner-large-mandoline,Benriner Mandoline: The $40 Japanese Slicer,Professional review of the Benriner mandoline after years of restaurant and home use. Japanese precision at an accessible price point.
Review,/reviews/black-decker-toaster-oven,"48 Years, 4 Toaster Ovens: Black+Decker Wins",1977 to today—Black+Decker keeps working. Real-world testing from a chef who's owned 4 models across nearly 5 decades.
Review,/reviews/bodum-chambord-french-press,"18 Years, Same French Press: Bodum Chambord","6 years at Purple Café, 18 years at home—still making perfect coffee. This French press doesn't quit."
Review,/reviews/cuisinart-8-inch-nonstick-pan,"Cuisinart 8"" Nonstick: The $25 Pan That Lasted 2 Years","Budget pan tested 2 years. Professional chef review of heat distribution, coating durability, and performance at this price point."
Review,/reviews/cuisinart-dlc-10c-classic-food-processor,"30 Years, Same Food Processor: Cuisinart DLC-10C","Three decades of shredding, slicing, chopping—still running strong. This is what buy-it-for-life actually means."
Review,/reviews/diamond-crystal-kosher-salt,Why Every Restaurant Uses Diamond Crystal Salt,18 years in professional kitchens—this is the salt. The flaky texture gives perfect control that table salt can't match.
Review,/reviews/epicurean-kitchen-cutting-board,The Cutting Board You Can Dishwasher (Really),10 years of testing—Epicurean survives the dishwasher without warping. Wood boards can't do that.
Review,/reviews/henckels-sharpening-steel,"20 Years, Same Honing Steel: Henckels Wins","Culinary school 2005, still using it today. This is the steel that keeps professional knives sharp between sharpenings."
Review,/reviews/instant-pot-duo-plus-6qt,90 Days Testing Instant Pot: Honest Results,"Daily testing by a professional chef—pot roast, rice, beans. Here's what the Instant Pot actually does well (and what it doesn't)."
Review,/reviews/japanese-wooden-spoon-set,Japanese Wooden Spoons: Why Chefs Use These,Professional review of traditional Japanese wooden cooking spoons. Why these handcrafted tools work better than metal or plastic.
Review,/reviews/john-boos-platinum-commercial-cutting-board,"14 Years, Same Cutting Board: John Boos Wins",Sanded it once. Oiled it occasionally. Still perfect after 14 years of daily chopping. This is what generational quality looks like.
Review,/reviews/kitchenaid-kp26m1xlc-professional-600,"18 Years, Same Stand Mixer: KitchenAid Pro 600",Weekly pizza dough for 18 years—never faltered. This is the mixer that handles what home bakers actually make.
Review,/reviews/kitchenaid-ksm8990wh,KitchenAid Commercial: 18 Months Restaurant Abuse,"Daily service in a real restaurant kitchen—pizza dough, bread, pasta. The NSF-certified mixer that handles commercial workloads."
Review,/reviews/large-metal-hotel-pans,Why Restaurants Use Metal Hotel Pans (Not Plastic),"24 years in commercial kitchens—metal hotel pans handle heat, steam tables, and high-volume service. Plastic can't."
Review,/reviews/large-plastic-hotel-pans,Why I Ditched Tupperware for Hotel Pans,20 years of meal prep—plastic hotel pans organize everything. Restaurant storage system that actually works at home.
Review,/reviews/le-creuset-signature-7-25-qt-dutch-oven,"12 Years, Same Dutch Oven: Le Creuset 7.25-Qt","Braising, baking, roasting—12 years of heavy use. The enamel coating is still perfect. This is what $400 actually buys."
Review,/reviews/lodge-seasoned-cast-iron-3-skillet-bundle,"7 Years, Same Cast Iron Pans: Lodge 3-Skillet Set","Three sizes (12"", 10.25"", 8"")—seven years of weekly use. The seasoning just keeps getting better. This is what $60 buys."
Review,/reviews/method-all-purpose-cleaner,The Non-Toxic Cleaner That Actually Cuts Grease,5 years in a chef's kitchen—Method cleaner handles bacon grease and oil spills without harsh chemicals. It actually works.
Review,/reviews/ninja-air-fryer-af101,Ninja Air Fryer: 4 Years of Daily Use (Honest Review),Professional chef tests this popular countertop convection oven for 4 years. What it does well and what it doesn't.
Review,/reviews/ninja-bl660-professional-blender,This $90 Blender Cracked After 2 Weeks,"90 days testing the Ninja BL660—wing sauce was perfect, but the pitcher cracked within 2 weeks. Here's the truth."
Review,/reviews/nordic-ware-half-sheet-pan,"10 Years, Never Warped: Nordic Ware Sheet Pan","I own 4 of these. 10 years of roasting, broiling, baking—perfectly flat. This is the pan professional bakers choose."
Review,/reviews/norton-im200-tri-stone-sharpener,6 Years Sharpening in a 200-Cover Restaurant,Norton Tri-Stone kept every knife razor-sharp through 6 years at Purple Café. This is the sharpener professionals choose.
Review,/reviews/oxo-good-grips-bench-scraper,OXO Bench Scraper: The Tool You Didn't Know You Needed,20 years of professional and home use. Why this underrated tool belongs in every kitchen—not just bakeries.
Review,/reviews/oxo-good-grips-swivel-peeler,OXO Peeler: Doesn't Hurt Your Hand After 50 Potatoes,20 years of professional and home use. Ergonomic design and comfortable grip for extended peeling sessions without hand fatigue.
Review,/reviews/robot-coupe-r2-dice,"Robot Coupe R2: The $3,000 Machine That Replaces 2 Cooks",3-year commercial test. 2 HP motor that saves hours daily in restaurant prep. Professional review of this prep powerhouse.
Review,/reviews/rubbermaid-commercial-cooks-scraper,"Rubbermaid Scraper: 18 Years, Never Replaced",Professional test across two commercial kitchens. This buy-it-for-life tool handles 500°F and outlasts everything else.
Review,/reviews/small-metal-hotel-pans,Small Metal Hotel Pans: Restaurant Secret for Hosting,"24 years using these in restaurants and at home. Perfect for BBQs, hot holding, oven roasting, and big family meals."
Review,/reviews/small-plastic-hotel-pans,Small Plastic Hotel Pans: Better Than Tupperware,20 years using these at home. NSF-approved containers that eliminate kitchen organization chaos. Restaurant storage system.
