Page Type,Path,Title,Description
Review,/reviews/victorinox-4-inch-paring-knife,"Victorinox 4"" Paring: Same Knife Since Culinary School","20 years of detail work, peeling, and trimming. Swiss precision at exceptional value—still using the same blade."
Review,/reviews/victorinox-fibrox-10-inch-chefs-knife,"Victorinox 10"" Chef: For Larger Hands (Pro Test)",10-year professional test. Perfect for big hands and big cutting tasks. Swiss precision and commercial durability at half the price.
Review,/reviews/victorinox-fibrox-8-inch-chefs-knife,"Victorinox 8"" Fibrox: Why Restaurants Buy This Knife",20-year test: professional-grade performance with exceptional value and NSF certification. The workhorse in restaurant kitchens.
Review,/reviews/victorinox-granton-edge-boning-knife,Victorinox Boning Knife: The Granton Edge Difference,20-year professional test. Firm blade for trimming and deboning—Granton edge prevents sticking on meat. Butcher's choice.
Review,/reviews/victorinox-offset-bread-knife,Victorinox Bread Knife: The Offset Handle Advantage,10-year professional test. Offset handle provides knuckle clearance for crusty bread and tomatoes. Restaurant tested design.
Review,/reviews/vitamix-5200-professional-blender,Vitamix 5200: 5 Years at Purple Café (Honest Review),Primary blending workhorse under demanding commercial conditions. Professional chef review with honest pros and cons of this $450 investment.
Review,/reviews/winco-heavy-duty-tongs,Winco Tongs: Restaurant Quality for $8,24 years of professional cooking with these extra heavyweight tongs. Restaurant-grade quality at a fraction of typical prices.
Review,/reviews/wusthof-classic-ikon-16-piece,"Wüsthof Ikon 16-Pc: German Engineering, $600 Price",6-year test of German-forged precision and ergonomic handles. Professional kitchen performance at premium pricing. Honest review.
Review,/reviews/zuperia-bar-mops,ZUPERIA Bar Mops: Better Than Restaurant Grade,Better quality than what I used for years in professional restaurants. Industry-standard ring-spun cotton that's absorbent and durable.
