Slug,URL,Title,Title Length,Description,Description Length
blog/why-resting-meat-key-cooking,https://www.chefapprovedtools.com/blog/why-resting-meat-key-cooking,Why Resting Meat is Critical - Professional Chef,48,"Learn why professional chefs never skip resting meat. Master carry-over cooking, juice redistribution, and the science behind perfectly cooked steaks, roasts, and poultry.",171
chef-approved,https://www.chefapprovedtools.com/chef-approved,Chef Approved Tools: What It Means | Professional Kitchen Equipment Reviews,75,Learn what ,11
contact,https://www.chefapprovedtools.com/contact,,0,,0
cookie-policy,https://www.chefapprovedtools.com/cookie-policy,Cookie Policy | Chef Approved Tools Notice,42,Cookie Policy for Chef Approved Tools - How we use cookies and similar technologies on our website.,99
cookware,https://www.chefapprovedtools.com/cookware,Best Cookware 2025 | Chef Pots & Pans Guide,43,"Professional cookware reviews: Pans, pots, Dutch ovens tested in restaurant kitchens or in my apartment . What works, what lasts. Chef-approved.",144
disclosure,https://www.chefapprovedtools.com/disclosure,Affiliate Disclosure | Chef Approved Tools,42,Full disclosure of our affiliate relationships and how we earn commissions from product reviews and recommendations.,116
glossary,https://www.chefapprovedtools.com/glossary,Kitchen Terms Glossary: Pro Cuts & Tools,40,"Kitchen terms defined: Equipment specs, knife cuts, baking conversions. Julienne, brunoise, NSF certification explained. Professional techniques guide.",151
guides,https://www.chefapprovedtools.com/guides,Kitchen Equipment Guides | Chef\,32,Expert guidance from a culinary professional to help you make informed equipment decisions.,91
guides/affordable-kitchen-appliances,https://www.chefapprovedtools.com/guides/affordable-kitchen-appliances,Budget Kitchen Appliances 2025: What Works,42,"Affordable kitchen appliances that work: Budget-friendly blenders, mixers tested by a professional chef. Restaurant quality without premium price.",146
guides/best-chef-knives,https://www.chefapprovedtools.com/guides/best-chef-knives,Best Chef Knives 2025: Expert Buying Guide,42,Best chef knives 2025: Professional chef reviews from 24 years experience. German workhorses to Japanese precision. Real restaurant kitchen testing.,148
guides/best-cookware,https://www.chefapprovedtools.com/guides/best-cookware,Restaurant-Grade Cookware: Pro Comparison,41,Professional cookware recommendations from 24 years of restaurant experience. Find pans that survive commercial use.,116
guides/cookware-materials,https://www.chefapprovedtools.com/guides/cookware-materials,Cookware Materials: Chef\,25,"Complete guide to cookware materials from 24 years of restaurant experience. Stainless steel, cast iron, carbon steel, and more.",128
guides/kitchen-appliances,https://www.chefapprovedtools.com/guides/kitchen-appliances,Commercial Kitchen Appliances 2025: Guide,41,"Professional kitchen appliance reviews. Blenders, mixers, food processors tested in restaurants or in my apartment kitchen. Commercial-grade performance.",153
guides/knife-care,https://www.chefapprovedtools.com/guides/knife-care,Knife Care: Sharpening & Storage Techniques,43,"Professional knife care guide: Sharpening, storage, maintenance from restaurant kitchen manager. Keep your knives performing for decades.",137
kitchen-bundle,https://www.chefapprovedtools.com/kitchen-bundle,Essential Kitchen Starter: 10 Year Pro-Tested,45,Professional kitchen starter kit: 10 essential tools tested 24 years. From knives to cookware. Restaurant veteran-approved. Build your pro kitchen.,147
knives,https://www.chefapprovedtools.com/knives,"Chef Knives Hub: All Reviews, Guides, Tips",42,"Professional chef reviews of kitchen knives tested over years in restaurant kitchens. Chef knives, paring knives, bread knives, and specialty blades.",149
newsletter,https://www.chefapprovedtools.com/newsletter,Equipment Newsletter: Pro Tips & Insights,41,Get equipment insights and honest product recommendations from 24 years of restaurant experience. Join fellow home chefs getting expert insights.,145
privacy-policy,https://www.chefapprovedtools.com/privacy-policy,Privacy Policy | Chef Approved Tools Legal,42,"Privacy policy for Chef Approved Tools - How we collect, use, and protect your personal information in compliance with GDPR and CCPA.",133
review-tiers,https://www.chefapprovedtools.com/review-tiers,Three-Tier Testing: Review Methodology,38,"Understand how we test and review kitchen equipment. Three tiers of transparency: Restaurant-tested, actively testing, and experience-based recommendations.",156
reviews,https://www.chefapprovedtools.com/reviews,All Reviews: Chef-Tested Kitchen Equipment,42,Complete collection of professional kitchen equipment reviews tested in real restaurant environments and home kitchens.,119
reviews/benriner-large-mandoline,https://www.chefapprovedtools.com/reviews/benriner-large-mandoline,Benriner Mandoline: Pro Safety & Precision | Chef Approved Tools,64,"Professional chef tests Benriner mandoline after years of restaurant use. Complete review: precision slicing, safety features, durability analysis.",147
reviews/black-decker-toaster-oven,https://www.chefapprovedtools.com/reviews/black-decker-toaster-oven,Black+Decker Toaster Oven: 48-Year Review | Chef Approved Tools,63,Black+Decker toaster oven review: 48 years across 4 models (1977-present). Professional chef tests durability and performance.,126
reviews/bodum-chambord-french-press,https://www.chefapprovedtools.com/reviews/bodum-chambord-french-press,Bodum Chambord: 18-Year French Press Test | Chef Approved Tools,63,"Professional chef tests Bodum French Press for 18 years (6 years at Purple Café, 18 years at home). Complete review: durability, coffee quality, value.",151
reviews/cuisinart-8-inch-nonstick-pan,https://www.chefapprovedtools.com/reviews/cuisinart-8-inch-nonstick-pan,Cuisinart 8,11,"Cuisinart 8-inch nonstick pan review. Professional chef tests for 6 months. Perfect for eggs, single servings. Induction ready.",127
reviews/cuisinart-dlc-10c-classic-food-processor,https://www.chefapprovedtools.com/reviews/cuisinart-dlc-10c-classic-food-processor,Cuisinart DLC-10C: 30-Year Durability Test | Chef Approved Tools,64,"Cuisinart DLC-10C review: 30 years home use. Professional chef tests shredding, slicing, durability. Buy-it-for-life appliance.",127
reviews/diamond-crystal-kosher-salt,https://www.chefapprovedtools.com/reviews/diamond-crystal-kosher-salt,Diamond Crystal Salt: Pro Kitchen Essential,43,"Diamond Crystal Kosher Salt review: 18 years professional and home use. Chef tests texture, flavor, pinchability. Industry standard.",132
reviews/epicurean-kitchen-cutting-board,https://www.chefapprovedtools.com/reviews/epicurean-kitchen-cutting-board,Epicurean Board: Dishwasher-Safe Pro Choice,43,Professional chef review of the Epicurean kitchen cutting board after 10 years of continual use in my apartment. Dishwasher-safe and better than wood.,150
reviews/henckels-sharpening-steel,https://www.chefapprovedtools.com/reviews/henckels-sharpening-steel,J.A. Henckels Sharpening Steel Review: 20 Years Professional Use,64,"Professional review of the J.A. Henckels sharpening steel after 20 years of daily use. Part of my required culinary school kit in 2005, still going strong today.",161
reviews/instant-pot-duo-plus-6qt,https://www.chefapprovedtools.com/reviews/instant-pot-duo-plus-6qt,Instant Pot Duo Plus 6 Qt Review: 90-Day Professional Test,58,Professional chef\,18
reviews/japanese-wooden-spoon-set,https://www.chefapprovedtools.com/reviews/japanese-wooden-spoon-set,Japanese Wooden Spoon Set: 3-Year Dishwasher Test,49,"After 3 years and 100+ dishwasher cycles, these Japanese wooden spoons became my go-to cooking tools. Honest review of durability, performance, and exceptional value.",166
reviews/john-boos-platinum-commercial-cutting-board,https://www.chefapprovedtools.com/reviews/john-boos-platinum-commercial-cutting-board,John Boos Board: 14-Year Butcher Block Test,43,"John Boos 24x18 cutting board review: 14 years home use. Chef tests knife preservation, durability, maintenance. Generational quality.",134
reviews/kitchenaid-kp26m1xlc-professional-600,https://www.chefapprovedtools.com/reviews/kitchenaid-kp26m1xlc-professional-600,KitchenAid Pro 600: Home Baker,30,"KitchenAid Professional 600 review: 18 years home use. Chef tests pizza dough, attachments, durability, value. Buy-it-for-life mixer.",133
reviews/kitchenaid-ksm8990wh,https://www.chefapprovedtools.com/reviews/kitchenaid-ksm8990wh,KitchenAid Commercial: Test NSF,31,"KitchenAid Commercial mixer review: 18 months restaurant testing. Chef reviews 1.3HP motor, NSF cert, 8-qt capacity, durability, ROI.",133
reviews/large-metal-hotel-pans,https://www.chefapprovedtools.com/reviews/large-metal-hotel-pans,Large Metal Hotel Pans Review: Commercial Hot Holding for Catering & Events,75,"24 years professional kitchen experience: Large metal hotel pans for catering businesses, commercial kitchens, and large-scale event hosting.",141
reviews/large-plastic-hotel-pans,https://www.chefapprovedtools.com/reviews/large-plastic-hotel-pans,Large Plastic Hotel Pans Review: Full & 1/3 Pans for Serious Meal Prep,70,"20 years professional experience: Large plastic hotel pans for batch cooking, party prep, and professional-level meal organization at home.",139
reviews/le-creuset-signature-7-25-qt-dutch-oven,https://www.chefapprovedtools.com/reviews/le-creuset-signature-7-25-qt-dutch-oven,Le Creuset 7.25-Qt: 12-Year Dutch Oven Test,43,"Le Creuset 7.25-qt Dutch Oven tested 12 years. French enameled cast iron, 500°F oven safe. Buy-it-for-life quality. Honest chef review.",135
reviews/lodge-seasoned-cast-iron-3-skillet-bundle,https://www.chefapprovedtools.com/reviews/lodge-seasoned-cast-iron-3-skillet-bundle,Lodge Cast Iron 3-Skillet: Home Use Review,42,Lodge cast iron 3-skillet set tested 7 years. Pre-seasoned 12\,62
reviews/method-all-purpose-cleaner,https://www.chefapprovedtools.com/reviews/method-all-purpose-cleaner,Method Cleaner: Non-Toxic Grease-Cutting,40,"Method All-Purpose Cleaner tested 5 years: powerful grease-cutting performance with genuinely non-toxic, plant-based ingredients. Professional kitchen approved.",160
reviews/ninja-air-fryer-af101,https://www.chefapprovedtools.com/reviews/ninja-air-fryer-af101,Ninja Air Fryer AF101 Review: 90-Day Wing & Frozen Food Test,60,"Professional chef tests the Ninja AF101 4qt air fryer for 90 days. Fresh wings, frozen foods, real results. Honest pros and cons from 24 years in kitchens.",155
reviews/ninja-bl660-professional-blender,https://www.chefapprovedtools.com/reviews/ninja-bl660-professional-blender,Ninja BL660 Professional Blender Review: 90-Day Honest Test,59,Professional chef,17
reviews/nordic-ware-half-sheet-pan,https://www.chefapprovedtools.com/reviews/nordic-ware-half-sheet-pan,Nordic Ware Sheet Pan: 10-Year Baker Test,41,"Nordic Ware half sheet pan: 10-year test. Why bakers choose this pan. Durability, even heating, warp resistance tested. Professional baker",138
reviews/norton-im200-tri-stone-sharpener,https://www.chefapprovedtools.com/reviews/norton-im200-tri-stone-sharpener,Norton Tri-Stone: Restaurant Sharpener Pro,42,"Professional chef tests Norton Tri-Stone sharpener for 6 years in a 200-cover restaurant. Complete review: sharpening performance, durability, and technique guide.",163
reviews/oxo-good-grips-bench-scraper,https://www.chefapprovedtools.com/reviews/oxo-good-grips-bench-scraper,OXO Bench Scraper: Underrated Kitchen MVP,41,Professional chef review of the OXO Good Grips bench scraper after 20 years of use (including 10 professional). The most underrated tool in any kitchen.,152
reviews/oxo-good-grips-swivel-peeler,https://www.chefapprovedtools.com/reviews/oxo-good-grips-swivel-peeler,OXO Swivel Peeler: Ergonomic Design Winner,42,"OXO swivel peeler tested 20 years (including 10 professional). Ergonomic design, sharp blade, and comfortable grip make this the best peeler for extended use.",158
reviews/robot-coupe-r2-dice,https://www.chefapprovedtools.com/reviews/robot-coupe-r2-dice,Robot Coupe R2: Commercial Prep Powerhouse,42,"Robot Coupe R2 Dice: 3-year commercial test. 2 HP motor, continuous feed. Saves hours daily in restaurant prep. Professional review.",132
reviews/rubbermaid-commercial-cooks-scraper,https://www.chefapprovedtools.com/reviews/rubbermaid-commercial-cooks-scraper,Rubbermaid Scraper: Buy-It-For-Life Tool,40,Professional chef tests Rubbermaid Commercial scraper for 18 years across two commercial kitchens. Complete review of this buy-it-for-life tool with 500°F heat resistance.,171
reviews/small-metal-hotel-pans,https://www.chefapprovedtools.com/reviews/small-metal-hotel-pans,Small Metal Hotel Pans Review: Stainless Steel for Hot Holding & Oven Use,73,"24 years professional experience: Small metal hotel pans for BBQs, hot holding, oven roasting, and family gatherings. Essential for home hosting.",145
reviews/small-plastic-hotel-pans,https://www.chefapprovedtools.com/reviews/small-plastic-hotel-pans,Small Plastic Hotel Pans Review: End Tupperware Chaos Forever,61,"After 20 years using plastic hotel pans at home, professional chef review of the NSF-approved containers that eliminate kitchen organization chaos.",147
reviews/victorinox-4-inch-paring-knife,https://www.chefapprovedtools.com/reviews/victorinox-4-inch-paring-knife,Victorinox 4\,13,Victorinox 4\,13
reviews/victorinox-fibrox-10-inch-chefs-knife,https://www.chefapprovedtools.com/reviews/victorinox-fibrox-10-inch-chefs-knife,Victorinox 10\,14,Victorinox 10\,14
reviews/victorinox-fibrox-8-inch-chefs-knife,https://www.chefapprovedtools.com/reviews/victorinox-fibrox-8-inch-chefs-knife,Victorinox 8\,13,Victorinox 8\,13
reviews/victorinox-granton-edge-boning-knife,https://www.chefapprovedtools.com/reviews/victorinox-granton-edge-boning-knife,Victorinox Granton Boning: Firm Blade Pro,41,"Victorinox Granton boning knife: 20-year pro test. Firm blade for trimming, deboning. Granton edge prevents sticking. Professional butcher tool.",144
reviews/victorinox-offset-bread-knife,https://www.chefapprovedtools.com/reviews/victorinox-offset-bread-knife,Victorinox Bread Knife: Offset Ergo Design,42,Victorinox offset bread knife: 10-year pro test. Perfect for crusty bread and tomatoes. Knuckle clearance that matters. Restaurant tested.,138
reviews/vitamix-5200-professional-blender,https://www.chefapprovedtools.com/reviews/vitamix-5200-professional-blender,Vitamix 5200 Blender Review: 5+ Years Professional Testing | Chef Approved Tools,80,"After 5+ years as our primary blending workhorse at Purple Cafe, the Vitamix 5200 delivered flawless performance under demanding commercial conditions. Professional chef review with honest pros and cons.",203
reviews/winco-heavy-duty-tongs,https://www.chefapprovedtools.com/reviews/winco-heavy-duty-tongs,Winco Extra Heavyweight Tongs: Restaurant Grade,47,Professional chef review of Winco extra heavyweight tongs after 24 years of professional cooking. Restaurant-grade tongs at a fraction of the price.,148
reviews/wusthof-classic-ikon-16-piece,https://www.chefapprovedtools.com/reviews/wusthof-classic-ikon-16-piece,Wüsthof Ikon 16-Pc: German Forged Quality,41,"Wusthof Classic Ikon 16-pc set tested 6 years. German-forged precision, ergonomic handles. Professional kitchen performance. Honest review.",139
reviews/zuperia-bar-mops,https://www.chefapprovedtools.com/reviews/zuperia-bar-mops,ZUPERIA Bar Mops: Industry Standard Cotton,42,ZUPERIA bar mops deliver better quality than those used for years in professional restaurants. Industry-standard 100% ring-spun cotton that\,140
terms,https://www.chefapprovedtools.com/terms,Terms of Service | Chef Approved Tools Info,43,Terms of Service for Chef Approved Tools - Legal terms and conditions for using our website and services.,105
the-tools-that-started-it-all,https://www.chefapprovedtools.com/the-tools-that-started-it-all,The Tools That Started It All - My Culinary School Essentials | Chef Approved Tools,83,The 11 essential kitchen tools I packed for culinary school in 2005 that I still use 20 years later. Professional-grade equipment that survived decades of restaurant abuse.,172