Slug,URL,Title,Title Length,Description,Description Length
/,https://www.chefapprovedtools.com,,0,,0
about,https://www.chefapprovedtools.com/about,About Scott Bradley & Testing Methodology,41,"Chef Scott Bradley: 24 years professional kitchen experience, including 7 years as Kitchen Manager. Restaurant-tested equipment reviews. Real conditions, honest reviews.",169
admin/products,https://www.chefapprovedtools.com/admin/products,,0,,0
appliances,https://www.chefapprovedtools.com/appliances,Kitchen Appliances 2025 | Pro Chef Reviews,42,"Professional chef reviews of blenders, mixers, food processors, and essential kitchen appliances tested in commercial restaurant settings.",138
best-budget-chef-knife,https://www.chefapprovedtools.com/best-budget-chef-knife,Best Budget Chef Knife 2025: Victorinox 8,41,Victorinox Fibrox 8\,20
best-knife-for-cutting-meat,https://www.chefapprovedtools.com/best-knife-for-cutting-meat,Best Meat Cutting Knife 2025: Boning Guide,42,Victorinox 6\,13
blog,https://www.chefapprovedtools.com/blog,Pro Cooking Techniques | Restaurant Methods,43,Professional cooking techniques from 24 years restaurant experience. Master methods that separate restaurant-quality from home cooking. Chef secrets revealed.,158
blog/bacon-but-not-in-this-dish,https://www.chefapprovedtools.com/blog/bacon-but-not-in-this-dish,When NOT to Use Bacon - Professional Chef,41,Learn when bacon overpowers dishes instead of enhancing them. Professional chef reveals 7 dishes where bacon doesn,114
blog/benefits-cooking-with-garlic,https://www.chefapprovedtools.com/blog/benefits-cooking-with-garlic,"Benefits of Cooking with Garlic: Flavor, Health & Pro Techniques | Chef Approved Tools",86,"Learn why garlic is essential in cooking—health benefits, flavor science, and professional techniques for using garlic properly. From a chef with 24 years of experience.",169
blog/best-scrambled-eggs,https://www.chefapprovedtools.com/blog/best-scrambled-eggs,Perfect Scrambled Eggs: Pro Chef Technique,42,"Professional chef shares revolutionary scrambled egg technique. No bowl, no whisk, no milk. Creamy, tender eggs in minutes. 45 years of cooking wisdom.",151
blog/blanching-vegetables-why-restaurants-do-it,https://www.chefapprovedtools.com/blog/blanching-vegetables-why-restaurants-do-it,Blanching Vegetables: Why Restaurants Do It,43,"Learn why professional kitchens blanch vegetables before service. Preserve color, texture, and flavor with a chef-tested method for perfect results.",148
blog/braising-101-tough-cuts-made-tender,https://www.chefapprovedtools.com/blog/braising-101-tough-cuts-made-tender,Braising 101: Tough Cuts Made Tender,36,"Professional chef explains the art and science of braising — transforming tough cuts into tender, flavorful perfection through low, slow heat and control.",154
blog/bread-science-gluten-development,https://www.chefapprovedtools.com/blog/bread-science-gluten-development,Bread Science: Understanding Gluten Development | Chef Approved Tools,69,"Learn the chemistry of gluten formation, kneading techniques, and how to troubleshoot bread problems. From a chef with 24 years of professional baking experience.",162
blog/caramelization-science,https://www.chefapprovedtools.com/blog/caramelization-science,The Science of Caramelization: How Sugar Creates Deep Flavor | Chef Approved Tools,82,Learn the chemistry behind caramelization and how heat transforms sugar into hundreds of complex flavor compounds. Master the techniques professional chefs use to build flavor through proper caramelization.,206
blog/caramelizing-onions-why-it-takes-45-minutes,https://www.chefapprovedtools.com/blog/caramelizing-onions-why-it-takes-45-minutes,Caramelizing Onions: Why It Takes 45 Minutes (Not 10),53,"Professional chef explains the real process of caramelizing onions — why patience, temperature, and technique matter more than shortcuts.",137
blog/carbon-footprint-kitchen-equipment-buy-once-cry-once,https://www.chefapprovedtools.com/blog/carbon-footprint-kitchen-equipment-buy-once-cry-once,"Carbon Footprint of Kitchen Equipment: Buy Once, Cry Once",57,Professional chef explains how quality kitchen equipment reduces waste and carbon footprint — why durability is the real sustainability in the kitchen.,151
blog/cast-iron-mistakes-ruin-pan,https://www.chefapprovedtools.com/blog/cast-iron-mistakes-ruin-pan,Cast Iron Mistakes That Ruin Your Pan (And How to Fix Them),59,"Professional chef explains the common cast iron mistakes that strip seasoning, cause rust, and ruin pans. Learn how to clean, season, and maintain cast iron the right way.",171
blog/cast-iron-seasoning-care,https://www.chefapprovedtools.com/blog/cast-iron-seasoning-care,Cast Iron Seasoning & Care: The Complete Professional Guide | Chef Approved Tools,81,"Learn the chemistry of cast iron seasoning, proper care techniques, and restoration methods from a chef with 24 years of professional experience. Make your cast iron last forever.",179
blog/cheese-sauce-mac-and-cheese,https://www.chefapprovedtools.com/blog/cheese-sauce-mac-and-cheese,How to Make a Cheese Sauce - Mac and Cheese Perfection | Chef Approved Tools,76,"Learn the professional technique for silky, smooth cheese sauce every time. Master béchamel, avoid graininess, and make restaurant-quality mac and cheese that never breaks.",172
blog/complete-guide-to-salts,https://www.chefapprovedtools.com/blog/complete-guide-to-salts,"The Complete Guide to Salts: Types, Uses & When to Use Each | Chef Approved Tools",81,"Master salt with professional techniques. Learn the differences between kosher salt, sea salt, table salt, and finishing salts—from a chef with 24 years of experience.",167
blog/cooking-with-tomatoes-fresh-vs-canned,https://www.chefapprovedtools.com/blog/cooking-with-tomatoes-fresh-vs-canned,Cooking with Tomatoes: Fresh vs Canned & When to Use Each | Chef Approved Tools,79,Learn when to use fresh tomatoes vs canned tomatoes in cooking. Professional insights from 24 years in restaurant kitchens on choosing the right tomatoes for every dish.,169
blog/cookware-materials-explained,https://www.chefapprovedtools.com/blog/cookware-materials-explained,Cookware Materials Explained: What Chefs Actually Use,53,"Professional chef explains the pros and cons of stainless steel, cast iron, nonstick, carbon steel, and copper cookware — and which belong in your kitchen.",155
blog/cutting-board-materials-guide,https://www.chefapprovedtools.com/blog/cutting-board-materials-guide,Which Cutting Board To Use? Advantages of Various Materials,59,"Chef Scott Bradley explains the pros and cons of wood, plastic, rubber, and bamboo cutting boards — and which are best for your knives and kitchen.",147
blog/cutting-storing-fresh-herbs,https://www.chefapprovedtools.com/blog/cutting-storing-fresh-herbs,How to Cut & Store Fresh Herbs - Professional Chef,50,"Master professional techniques for cutting, storing, and preserving fresh herbs. Learn why technique matters and how to keep herbs fresh for days.",146
blog/deglazing-pan-sauces,https://www.chefapprovedtools.com/blog/deglazing-pan-sauces,The Art of Deglazing: Making Pan Sauces | Chef Approved Tools,61,"Master deglazing and pan sauces from a professional chef with 24 years of restaurant experience. Learn the technique, understand fond, and create restaurant-quality sauces at home in minutes.",191
blog/deglazing-secret-to-restaurant-quality-flavor,https://www.chefapprovedtools.com/blog/deglazing-secret-to-restaurant-quality-flavor,Deglazing: The Secret to Restaurant-Quality Flavor,50,"Learn how to deglaze like a professional chef — the science of fond, proper technique, and how to build flavor into every pan sauce.",132
blog/dutch-oven-size-guide-which-quart-size,https://www.chefapprovedtools.com/blog/dutch-oven-size-guide-which-quart-size,Dutch Oven Size Guide: Which Quart Size Do You Need?,52,A professional chef\,20
blog/essential-knife-cuts-every-cook-should-master,https://www.chefapprovedtools.com/blog/essential-knife-cuts-every-cook-should-master,The 5 Essential Knife Cuts Every Home Cook Should Master,56,"Learn the five professional knife cuts—dice, julienne, chiffonade, mince, and bias—taught by chef Scott Bradley. Technique, precision, and practice tips for home cooks.",168
blog/fat-is-flavor,https://www.chefapprovedtools.com/blog/fat-is-flavor,Why Fat is Flavor: How Professional Chefs Use Fat to Build Taste | Chef Approved Tools,86,"Learn why fat is essential for flavor development in cooking and how professional chefs use butter, oil, and animal fats to create restaurant-quality dishes at home.",165
blog/food-processor-vs-blender,https://www.chefapprovedtools.com/blog/food-processor-vs-blender,Food Processor vs Blender: Which Do You Actually Need?,54,"Professional chef explains the difference between blenders and food processors, when to use each, and which models perform best in real kitchens.",145
blog/guide-cooking-oils-smoke-points,https://www.chefapprovedtools.com/blog/guide-cooking-oils-smoke-points,Guide to Cooking Oils & Smoke Points: Which Oil for Which Job | Chef Approved Tools,83,"Master cooking oils with professional techniques. Learn smoke points, best uses, and which oils to use for searing, sautéing, frying, and finishing.",148
blog/hotel-pan-system-restaurant-organization-home,https://www.chefapprovedtools.com/blog/hotel-pan-system-restaurant-organization-home,Hotel Pan System Review: Restaurant Organization for Home Kitchens,66,"After 24 years in professional kitchens and 20 years using hotel pans at home, discover why this restaurant system eliminates Tupperware chaos forever.",151
blog/how-to-choose-first-chef-knife,https://www.chefapprovedtools.com/blog/how-to-choose-first-chef-knife,How to Choose Your First Chef Knife (Like a Professional Chef),62,"Learn how to choose your first chef knife from a professional chef. Understand balance, steel type, blade length, and why comfort matters more than price.",154
blog/how-to-clean-burnt-stainless-steel-pans,https://www.chefapprovedtools.com/blog/how-to-clean-burnt-stainless-steel-pans,How to Clean Burnt Stainless Steel Pans,39,"Professional chef explains how to clean burnt stainless steel cookware using safe, effective methods — no harsh scrubbing or damage.",132
blog/how-to-cook-perfect-pasta,https://www.chefapprovedtools.com/blog/how-to-cook-perfect-pasta,How to Cook Perfect Pasta: Professional Technique | Chef Approved Tools,71,"Master pasta cooking from a professional chef with 24 years of restaurant experience. Learn proper water ratios, timing, salt levels, and the secret to restaurant-quality pasta at home.",185
blog/how-to-make-perfect-french-press-coffee,https://www.chefapprovedtools.com/blog/how-to-make-perfect-french-press-coffee,French Press Coffee: Perfect Ratio & Method,43,"French press coffee perfected: 18 years usage experience. Perfect ratio, step-by-step technique, mistakes to avoid. Cafe-quality at home. Professional guide.",157
blog/how-to-make-perfect-risotto,https://www.chefapprovedtools.com/blog/how-to-make-perfect-risotto,"How to Make Perfect Risotto: Technique, Timing, and Science | Chef Approved Tools",81,"Master risotto from a professional chef with 24 years of restaurant experience. Learn proper technique, timing, stock selection, and the science behind perfectly creamy rice without cream.",188
blog/how-to-make-roux,https://www.chefapprovedtools.com/blog/how-to-make-roux,How to Make a Perfect Roux: Master This Essential Sauce Technique | Chef Approved Tools,87,Learn how to make a roux the right way—from white to blonde to dark. Master the technique that,94
blog/how-to-preheat-a-pan,https://www.chefapprovedtools.com/blog/how-to-preheat-a-pan,How to Preheat a Pan: Temperature Matters More Than You Think,61,Professional chef explains the science of preheating stainless steel and cast iron pans — how to prevent sticking and achieve perfect sear every time.,150
blog/how-to-sear-steaks-like-restaurant-chef,https://www.chefapprovedtools.com/blog/how-to-sear-steaks-like-restaurant-chef,How to Sear Steaks Like Restaurant Chefs,40,"Restaurant steak searing: 24-year professional reveals the best techniques. Perfect crust, temperature control. Former Kitchen Manager secrets.",143
blog/how-to-season-cast-iron-like-restaurant-chef,https://www.chefapprovedtools.com/blog/how-to-season-cast-iron-like-restaurant-chef,How to Season Cast Iron Like a Restaurant Chef,46,"Professional chef explains how to season cast iron for a smooth, long-lasting nonstick surface. Learn oil types, baking steps, and common mistakes to avoid.",156
blog/how-to-sharpen-with-tri-stone,https://www.chefapprovedtools.com/blog/how-to-sharpen-with-tri-stone,Sharpen with Tri-Stone: Step-by-Step Pro,40,"Sharpen knives with tri-stone: 6-year restaurant technique. Step-by-step angles, pressure, progression guide. Professional results at home. Norton IM200 test.",158
blog/how-to-steel-a-knife,https://www.chefapprovedtools.com/blog/how-to-steel-a-knife,How to Steel a Knife: Professional Honing,41,"How to steel a knife: Professional honing technique. Honing vs sharpening explained. Perfect angle, pressure. Chef guide to knife maintenance.",142
blog/hydration-health-water-intake,https://www.chefapprovedtools.com/blog/hydration-health-water-intake,Kitchen Hydration Guide - Chef,30,Learn how professional chefs stay hydrated during long shifts and why proper water intake matters for home cooks. Science-backed hydration strategies for the kitchen.,166
blog/kitchen-gloves-guide,https://www.chefapprovedtools.com/blog/kitchen-gloves-guide,Kitchen Gloves: Cut-Resistant Safety Guide,42,"Learn professional kitchen glove safety from chef with 24 years restaurant experience. Single-use, cut-resistant, and proper layering techniques.",145
blog/kitchen-starter-kit-first-5-tools,https://www.chefapprovedtools.com/blog/kitchen-starter-kit-first-5-tools,Kitchen Starter Kit: First 5 Tools to Buy | Chef Scott Bradley,62,"Chef Scott Bradley reveals the five essential kitchen tools every home cook needs first. No fluff, no gimmicks—just the gear professionals actually use daily.",158
blog/kitchen-thermometer-guide,https://www.chefapprovedtools.com/blog/kitchen-thermometer-guide,Kitchen Thermometer Guide: Instant Read (and Why Every Chef Trusts One),71,"Professional chef explains how to use an instant-read thermometer correctly for perfect doneness, safety, and consistency in every dish.",136
blog/kitchen-thermometers-guide,https://www.chefapprovedtools.com/blog/kitchen-thermometers-guide,The Complete Guide to Kitchen Thermometers | Chef Approved Tools,64,"Master food temperature from a professional chef with 24 years of restaurant experience. Learn which thermometer to use, proper technique, and exact temperatures for perfect results every time.",193
blog/kitchen-tools-wasting-money,https://www.chefapprovedtools.com/blog/kitchen-tools-wasting-money,10 Kitchen Tools You\,21,Professional chef breaks down the 10 kitchen tools most home cooks waste money on and shares which essential tools professionals actually use instead.,150
blog/knife-block-vs-magnetic-strip-vs-drawer-storage,https://www.chefapprovedtools.com/blog/knife-block-vs-magnetic-strip-vs-drawer-storage,Knife Block vs Magnetic Strip vs Drawer: What\,46,"Professional chef explains the pros and cons of knife blocks, magnetic strips, and drawer storage. Learn how to protect your knives, save counter space, and avoid dulling your edges.",182
blog/knife-cuts-guide,https://www.chefapprovedtools.com/blog/knife-cuts-guide,"Understanding Knife Cuts: Julienne, Brunoise, Chiffonade | Chef Approved Tools",78,"Master classical knife cuts from a professional chef with 24 years of restaurant experience. Learn proper julienne, brunoise, chiffonade, and more—with techniques that actually work in real kitchens.",199
blog/knife-mistakes-home-cooks-make,https://www.chefapprovedtools.com/blog/knife-mistakes-home-cooks-make,5 Knife Mistakes Home Cooks Make (And How to Fix Them),54,"Professional chef explains the 5 knife mistakes that ruin edges and slow prep. Learn correct cutting techniques and maintenance tips for sharp, safe blades.",156
blog/knife-safety-protect-fingers,https://www.chefapprovedtools.com/blog/knife-safety-protect-fingers,Knife Safety: How to Protect Your Fingers Like a Professional Chef,66,"Learn the professional techniques that prevent knife accidents. Master the claw grip, proper knife handling, and the safety habits used in restaurant kitchens after 24 years on the line.",186
blog/knife-safety-rules-professional-kitchens,https://www.chefapprovedtools.com/blog/knife-safety-rules-professional-kitchens,Knife Safety: 10 Rules From 24 Years in Professional Kitchens,61,"Professional chef Scott Bradley shares 10 essential knife safety rules from 24 years in restaurants. Learn grip, stance, focus, and habits to prevent injuries in your kitchen.",175
blog/knife-skills-how-to-hold-chef-knife,https://www.chefapprovedtools.com/blog/knife-skills-how-to-hold-chef-knife,Knife Skills: How to Hold a Chef,32,"Learn the professional pinch grip, claw position, and rocking motion from a chef with 24 years of experience. Master knife skills that make cooking safer, faster, and more enjoyable.",182
blog/knife-storage-protecting-blades-for-decades,https://www.chefapprovedtools.com/blog/knife-storage-protecting-blades-for-decades,Knife Storage: Protecting Your Blades for Decades,49,"Learn how to store knives like a professional chef. Prevent dull edges, rust, and damage with proven storage techniques and chef-approved tools.",144
blog/maillard-reaction-browning-flavor,https://www.chefapprovedtools.com/blog/maillard-reaction-browning-flavor,The Maillard Reaction: Why Browning Equals Flavor | Chef Approved Tools,71,Learn the food science behind perfect browning from a chef with 24 years of professional kitchen experience. Master the Maillard reaction for restaurant-quality flavor at home.,176
blog/making-stock-professional-chef-method,https://www.chefapprovedtools.com/blog/making-stock-professional-chef-method,Making Stock: Professional Chef Method – How to Build Flavor | Chef Scott Bradley,81,"Professional chef Scott Bradley explains the real restaurant method for making stock. Build deep flavor with bones, vegetables, and proper simmering technique.",159
blog/meal-prep-station-setup-restaurant-efficiency,https://www.chefapprovedtools.com/blog/meal-prep-station-setup-restaurant-efficiency,Meal Prep Station Setup: Restaurant Efficiency at Home,54,"Professional chef explains how to create a restaurant-style meal prep station at home — mise en place, flow, and efficiency techniques that make cooking effortless.",164
blog/meat-cooking-temperatures-thermometers,https://www.chefapprovedtools.com/blog/meat-cooking-temperatures-thermometers,Meat Temps & Thermometers: Safety Guide,39,Professional chef explains meat thermometers and proper cooking temps. 24 years restaurant experience. Food safety + perfect doneness every time.,145
blog/mis-en-place-professional-cooking,https://www.chefapprovedtools.com/blog/mis-en-place-professional-cooking,Mis en Place: The Professional Chef,35,"Learn why mise en place is the foundation of every professional kitchen. Master the organization and prep techniques that make cooking faster, cleaner, and more enjoyable—straight from 24 years on the line.",206
blog/onions-cooking-guide,https://www.chefapprovedtools.com/blog/onions-cooking-guide,"Complete Guide to Cooking Onions: Types, Techniques & Pro Tips | Chef Approved Tools",84,"Master onions with this guide from a professional chef. Learn which onion varieties work best for different dishes, how to cut without crying, and professional cooking techniques.",179
blog/oxidization-effect-on-food,https://www.chefapprovedtools.com/blog/oxidization-effect-on-food,Food Oxidation Guide - Stop Browning & Preserve Freshness | Chef Approved Tools,79,"Learn how oxidation affects food quality and professional techniques to prevent browning, preserve flavor, and extend ingredient freshness in your kitchen.",155
blog/potatoes-cooking-guide,https://www.chefapprovedtools.com/blog/potatoes-cooking-guide,"Complete Guide to Cooking Potatoes: Varieties, Methods & Pro Tips | Chef Approved Tools",87,"Master potatoes with this complete guide from a professional chef. Learn which potato varieties work best for frying, roasting, mashing, and boiling—plus professional techniques.",178
blog/professional-knife-grip-techniques,https://www.chefapprovedtools.com/blog/professional-knife-grip-techniques,Professional Chef Knife Grip Techniques,39,"Learn how chefs actually hold knives. Chef Scott Bradley explains the pinch grip, claw method, and cutting stance for safety and control.",137
blog/reducing-sauces-restaurant-technique,https://www.chefapprovedtools.com/blog/reducing-sauces-restaurant-technique,Reducing Sauces: The Technique Restaurants Use Daily,52,"Professional chef explains the art of reducing sauces — how to concentrate flavor, control consistency, and create restaurant-quality reductions at home.",153
blog/roasting-vegetables-restaurant-guide,https://www.chefapprovedtools.com/blog/roasting-vegetables-restaurant-guide,Roasting Vegetables: Restaurant Temperature & Timing Guide,58,"Professional chef explains how to roast vegetables perfectly — the right temperature, spacing, oil, and timing for crisp, caramelized results.",142
blog/sheet-pan-cooking-restaurant-techniques,https://www.chefapprovedtools.com/blog/sheet-pan-cooking-restaurant-techniques,Sheet Pan Cooking: 5 Restaurant Techniques for Home,51,"Professional chef reveals 5 restaurant sheet pan techniques that transform home cooking. Learn high-heat roasting, batch prep, and finishing methods from 24 years in commercial kitchens.",186
blog/stainless-steel-why-food-sticks,https://www.chefapprovedtools.com/blog/stainless-steel-why-food-sticks,Stainless Steel Cooking: Why Food Sticks (And How to Fix It),60,"Professional chef explains why food sticks to stainless steel pans and how to prevent it using temperature, oil, and timing. Learn the science behind perfect sears.",164
blog/stand-mixer-buying-guide,https://www.chefapprovedtools.com/blog/stand-mixer-buying-guide,Stand Mixer Buying Guide: KitchenAid vs Alternatives,52,"Professional chef compares KitchenAid mixers vs top alternatives. Learn what to look for in power, capacity, attachments, and reliability before you buy.",153
blog/stock-vs-broth-vs-bouillon,https://www.chefapprovedtools.com/blog/stock-vs-broth-vs-bouillon,Stock vs Broth vs Bouillon: Differences & When to Use Each | Chef Approved Tools,80,"Learn the real differences between stock, broth, and bouillon—gelatin content, flavor profiles, and when to use each. From a chef with 24 years of professional experience.",171
blog/understanding-acids-cooking,https://www.chefapprovedtools.com/blog/understanding-acids-cooking,Understanding Acids in Cooking: How to Balance Flavor Like a Pro | Chef Approved Tools,86,"Learn how professional chefs use acids (lemon, vinegar, tomatoes) to brighten dishes and balance flavors. Master the technique that transforms good food into great food.",169
blog/understanding-cooking-fats,https://www.chefapprovedtools.com/blog/understanding-cooking-fats,Understanding Cooking Fats: Butter vs Oil vs Lard | Chef Approved Tools,71,"Learn when to use butter, oil, or lard from a professional chef with 24 years of restaurant experience. Understand smoke points, flavor profiles, and the science behind cooking fats.",182
blog/understanding-umami-fifth-taste,https://www.chefapprovedtools.com/blog/understanding-umami-fifth-taste,Understanding Umami: The Fifth Taste That Makes Food Delicious | Chef Approved Tools,84,"Learn what umami is, the science behind it, and how to use it to make food taste incredible. Includes natural sources, MSG facts, and professional techniques from 24 years in kitchens.",184
blog/vegetable-roasting-guide,https://www.chefapprovedtools.com/blog/vegetable-roasting-guide,Vegetable Roasting Guide: Times and Temperatures | Chef Approved Tools,70,"Master vegetable roasting from a professional chef with 24 years of restaurant experience. Learn exact times, temperatures, and techniques for perfectly roasted vegetables every time.",183
blog/what-is-braising,https://www.chefapprovedtools.com/blog/what-is-braising,What is Braising and Why It,27,"Learn the professional braising technique that transforms tough, cheap cuts into restaurant-quality meals. Master the science of collagen, proper liquid levels, and why low and slow wins.",187
blog/what-is-emulsification,https://www.chefapprovedtools.com/blog/what-is-emulsification,What is Emulsification? The Science Behind Creamy Sauces | Chef Approved Tools,78,Learn how emulsification works and why it,41
blog/why-children-hate-broccoli,https://www.chefapprovedtools.com/blog/why-children-hate-broccoli,Why Kids Hate Broccoli - Science & Solutions | Chef Approved Tools,66,Learn the science behind why children hate broccoli and professional techniques to make vegetables appealing. From bitter sensitivity to proper cooking methods.,160
blog/why-cooking-science-matters,https://www.chefapprovedtools.com/blog/why-cooking-science-matters,Why Cooking Science Matters: Understanding Chemistry Makes You Better | Chef Approved Tools,91,Learn why understanding cooking science transforms you from following recipes to mastering techniques. Professional insights from 24 years in restaurant kitchens.,162
blog/why-professional-chefs-use-kosher-salt,https://www.chefapprovedtools.com/blog/why-professional-chefs-use-kosher-salt,Why Kosher Salt: Chef\,22,"Why chefs use kosher salt: Professional kitchen secret explained. Diamond Crystal vs Morton, proper technique. Essential in commercial kitchens.",144
